{
  "meta": {
    "dataset": "quiz",
    "schema": "schemas/quiz.schema.json",
    "as_of": "2026-10-25",
    "version": "1.0.0",
    "description": "Perception-gap quiz (file 20 §6): documented misperceptions and the 41-item bank (25 core + 16 rotation; Q36-Q40 added 2026-10-25 to balance left- and right-coded items; Q40 recoded 'both' and Q41 added the same day to keep the balance). French wording is a draft for editorial review.",
    "conventions": "Decimal points and no thousands separators in JSON numbers; French formatting (comma decimal, narrow no-break space) is applied at render time. EUR bn = billions of euros, current prices. Every share says % of GDP or % of total public expenditure."
  },
  "design": {
    "modes": [
      "teaser (3 questions)",
      "full (25)",
      "classroom (anonymous group aggregate)",
      "by electorate (optional, consent)"
    ],
    "scoring": "Log-distance score; a guess within x1.25 of the true value scores full points.",
    "symmetry_rule": "Every draw contains exactly as many left-coded as right-coded items (file 20 §6.3, tightened 2026-10-25: never more right- than left-coded items, and vice versa). See draw_rule.",
    "options_note": "Distractor options are editorial drafts (orders of magnitude for the guess), not figures.",
    "data_collection": "Answers stored anonymously with GDPR consent (CNIL); results published quarterly; respondents self-selected.",
    "draw_rule": {
      "constraint": "count(camp_coding == 'right') == count(camp_coding == 'left') in every draw",
      "coded_camps": [
        "left",
        "right"
      ],
      "neutral_codings": [
        "general",
        "both",
        "pessimism",
        "anti_tax"
      ],
      "draw_sizes": {
        "teaser": 3,
        "full": 25,
        "classroom": 25,
        "by_electorate": 25
      },
      "procedure": "For a draw of n items: k_min = max(0, ceil((n - N_neutral) / 2)), k_max = min(N_left, N_right, floor(n / 2)); pick k uniformly in [k_min, k_max]; draw k left-coded, k right-coded and n - 2k neutral items at random without replacement; shuffle.",
      "bank_requirement": "The bank holds the same number of left- and right-coded items, so that both camps rotate at the same rate.",
      "checked_by": "validate.py (bank balance, feasibility for each draw size, and 500 seeded draws of the reference procedure)"
    }
  },
  "misperceptions": [
    {
      "id": "M1",
      "belief_en": "Debt estimated at 76% of GDP on average; 37% 'don't know'; only 25% say 'above 100%'.",
      "belief_fr": "Dette estimée en moyenne à 76 % du PIB ; 37 % « ne savent pas » ; seuls 25 % disent « plus de 100 % ».",
      "survey": {
        "pollster": "Ipsos",
        "sponsor": "MINEFI, for the Commission sur l'avenir des finances publiques (Arthuis)",
        "fieldwork": "18-21 Jan 2021",
        "n": 1000,
        "mode": "online access panel, quotas"
      },
      "true_value_en": "98.2% (end-2019); 114.9% (end-2020, current vintage); 115.7% end-2025",
      "true_value_figure_ids": [
        "debt_2025_pct_gdp"
      ],
      "gap_en": "Underestimated by about 22-39 points",
      "orientation_flag": null,
      "source_ids": [
        "f20:ipsos21"
      ]
    },
    {
      "id": "M2",
      "belief_en": "73% feel poorly informed about the level and cost of the debt.",
      "belief_fr": "73 % se sentent mal informés sur le niveau et le coût de la dette.",
      "survey": {
        "pollster": "Ipsos",
        "sponsor": "MINEFI",
        "fieldwork": "18-21 Jan 2021",
        "n": 1000,
        "mode": "online access panel, quotas"
      },
      "true_value_en": null,
      "true_value_figure_ids": [],
      "gap_en": null,
      "orientation_flag": null,
      "source_ids": [
        "f20:ipsos21"
      ]
    },
    {
      "id": "M3",
      "belief_en": "Causes of the debt: 'high social protection' cited by 30%, 'lost revenue from certain reforms' by 21%.",
      "belief_fr": "Causes de la dette : « protection sociale élevée » citée par 30 %, « recettes perdues à cause de certaines réformes » par 21 %.",
      "survey": {
        "pollster": "Ipsos",
        "sponsor": "MINEFI",
        "fieldwork": "18-21 Jan 2021",
        "n": 1000,
        "mode": "online access panel, quotas"
      },
      "true_value_en": "Social protection + health = 57% of TE; tax cuts 2018-2023 = EUR 62 bn a year",
      "true_value_figure_ids": [
        "cofog_social_protection_2024_pct_te",
        "cofog_health_2024_pct_te",
        "tax_cuts_2018_2023_eur_bn"
      ],
      "gap_en": "Both structural explanations (social spending and tax cuts) are under-cited",
      "orientation_flag": null,
      "source_ids": [
        "f20:ipsos21",
        "f00:row28"
      ]
    },
    {
      "id": "M4",
      "belief_en": "Main source of the debt: State 55%, social security 22%, local authorities 8%.",
      "belief_fr": "Principale source de la dette : État 55 %, sécurité sociale 22 %, collectivités 8 %.",
      "survey": {
        "pollster": "Ipsos",
        "sponsor": "MINEFI",
        "fieldwork": "18-21 Jan 2021",
        "n": 1000,
        "mode": "online access panel, quotas"
      },
      "true_value_en": "Share of Maastricht debt at end-2020: State 78%, social security 10%, local authorities 8.5%",
      "true_value_figure_ids": [],
      "gap_en": "The public is broadly right here: a 'you got it right' moment",
      "orientation_flag": null,
      "source_ids": [
        "f20:ipsos21"
      ]
    },
    {
      "id": "M5",
      "belief_en": "Spending to cut first: running costs of the State and public services 67%, social benefits incl. pensions 14%.",
      "belief_fr": "Dépenses à réduire en priorité : train de vie de l'État et des services publics 67 %, prestations sociales y compris retraites 14 %.",
      "survey": {
        "pollster": "Ipsos",
        "sponsor": "MINEFI",
        "fieldwork": "18-21 Jan 2021",
        "n": 1000,
        "mode": "online access panel, quotas"
      },
      "true_value_en": "Social protection 41.5% + health 15.6% of TE",
      "true_value_figure_ids": [
        "cofog_social_protection_2024_pct_te",
        "cofog_health_2024_pct_te"
      ],
      "gap_en": "Cut preferences fall on the smaller items",
      "orientation_flag": null,
      "source_ids": [
        "f20:ipsos21"
      ]
    },
    {
      "id": "M6",
      "belief_en": "Cut ranking: family 34%, business aid 33%, unemployment 30% ... pensions 7%, health 6%, education 5%.",
      "belief_fr": "Classement des coupes : famille 34 %, aides aux entreprises 33 %, chômage 30 % ... retraites 7 %, santé 6 %, éducation 5 %.",
      "survey": {
        "pollster": "Elabe",
        "sponsor": "Les Echos",
        "fieldwork": "1-2 Sep 2026",
        "n": 1005,
        "mode": null
      },
      "true_value_en": "Family 4.0%, unemployment 2.9%, old age 23.4%, health 15.6%, education 8.9% of TE (COFOG 2024)",
      "true_value_figure_ids": [
        "cofog_old_age_2024_pct_te",
        "cofog_health_2024_pct_te",
        "cofog_education_2024_pct_te"
      ],
      "gap_en": "Most-cited items (family + unemployment) ≈ 7% of TE; protected items (old age + health + education) ≈ 48% of TE. Name the items whenever either number is shown.",
      "orientation_flag": null,
      "source_ids": [
        "f20:elabe26",
        "f14"
      ]
    },
    {
      "id": "M7",
      "belief_en": "79% / 74% find taxing big firms / the wealthiest 'effective' against the debt.",
      "belief_fr": "79 % / 74 % jugent « efficace » contre la dette de taxer les grandes entreprises / les plus riches.",
      "survey": {
        "pollster": "Elabe",
        "sponsor": "Les Echos and Institut Montaigne",
        "fieldwork": "1-2 Oct 2024",
        "n": 1007,
        "mode": null
      },
      "true_value_en": "Wealth taxes: 0.1-0.8 pt of GDP vs an adjustment need of 4.4 pts",
      "true_value_figure_ids": [
        "tax_rich_package_eur_bn"
      ],
      "gap_en": "Overstated weight",
      "orientation_flag": null,
      "source_ids": [
        "f14"
      ]
    },
    {
      "id": "M8",
      "belief_en": "47% think retirees' living standard is below the population average; 18% think the system is funded; 50% think current contributions will pay pensions at least as high as today's.",
      "belief_fr": "47 % pensent que le niveau de vie des retraités est inférieur à la moyenne ; 18 % croient le système par capitalisation ; 50 % pensent que les cotisations actuelles paieront des pensions au moins aussi élevées.",
      "survey": {
        "pollster": "Toluna-Harris Interactive",
        "sponsor": "Observatoire Hexagone (favors a funded pillar: orientation flagged)",
        "fieldwork": "21-24 Feb 2025",
        "n": 1101,
        "mode": "online, quotas and weighting"
      },
      "true_value_en": "100.2% (COR, 2023); pay-as-you-go system; projected about 90% by 2070",
      "true_value_figure_ids": [
        "retirees_relative_living_standard_pct"
      ],
      "gap_en": "Pessimism about current retirees; optimism about future pensions",
      "orientation_flag": "Sponsor favors adding a funded pension pillar.",
      "source_ids": [
        "f20:hexagone",
        "f03"
      ]
    },
    {
      "id": "M9",
      "belief_en": "44% think retirees are worse off.",
      "belief_fr": "44 % pensent que les retraités sont moins bien lotis.",
      "survey": {
        "pollster": "Drees Baromètre",
        "sponsor": "Drees",
        "fieldwork": "Oct-Dec 2025",
        "n": 4000,
        "mode": "face to face"
      },
      "true_value_en": "100.2%",
      "true_value_figure_ids": [
        "retirees_relative_living_standard_pct"
      ],
      "gap_en": null,
      "orientation_flag": null,
      "source_ids": [
        "f14"
      ]
    },
    {
      "id": "M10",
      "belief_en": "72% think taxes have risen since 2017.",
      "belief_fr": "72 % pensent que les impôts ont augmenté depuis 2017.",
      "survey": {